{
  "schemaVersion": "0.1.0",
  "generatedAt": "2026-10-07",
  "basis": [
    "Phase 2 Closeout v0.1 frozen seven-city research state",
    "Phase 2 Maturity Audit v0.1 across all 296 morphology zones",
    "No new external research performed for this register",
    "Phase 3 applied exception results P3-001, P3-003, P3-004 and P3-005; original Phase 2 unresolved register preserved in frozen input"
  ],
  "portfolioResearchState": "phase3-exception-research-in-progress",
  "purpose": "Active unresolved-question register after applying completed Phase 3 exceptions, while preserving the Phase 2 register in the frozen input and resolved outcomes in the Phase 3 completion ledger.",
  "sourceIssueInstanceCount": 176,
  "sourceSharedFamilyUnresolvedStatementCount": 16,
  "summary": {
    "consolidatedQuestionCount": 15,
    "phase3ExceptionResearchCount": 5,
    "conditionalPhase3Count": 3,
    "productionTimedCheckCount": 2,
    "documentedUncertaintyCount": 5,
    "phase3AffectedZoneCount": 9,
    "conditionalPhase3AffectedZoneCount": 12
  },
  "triagePrinciples": [
    "Research further only when uncertainty can materially change a structural family, city/regional variation, repetition rule, bespoke decision or defining spatial grammar.",
    "Defer time-sensitive planned/transition/as-built questions to production freeze rather than manufacturing present certainty.",
    "Treat authoritative geometry/buildability replacement as pre-integration work unless it changes morphology classification.",
    "Do not research ordinary facade/material detail merely to increase completeness; reopen it only when prototyping demonstrates an identity failure.",
    "Preserve shared-family caveats and intentional exclusions rather than forcing symmetric cross-city families."
  ],
  "questions": [
    {
      "id": "P3-002",
      "title": "Elche Ciudad Jardín villa kit boundary",
      "category": "family-decision",
      "disposition": "phase3-exception-research",
      "priority": "high",
      "phase3Rank": 4,
      "scope": {
        "cityIds": [
          "elche"
        ],
        "zonesByCity": {
          "elche": [
            "z-nuevo-altabix-open"
          ]
        },
        "buildingIds": [
          "bldg-elche-citygarden-detached-villa",
          "bldg-elche-institutional",
          "bldg-elche-openblock-apartment",
          "bldg-elche-rowhouse-villa"
        ],
        "sharedFamilyIds": [
          "arch-detached-mediterranean-house",
          "arch-institutional-campus-block",
          "arch-lowrise-rowhouse-townhouse",
          "arch-open-block-apartment-slab"
        ]
      },
      "unresolvedQuestion": "Is the Ciudad Jardín detached-house condition sufficiently represented by the shared Mediterranean-villa structure, or does its current plot/building grammar require a distinct Elche city-specific variation?",
      "whyItMatters": "Phase 2 isolated Ciudad Jardín as a meaningful detached-house family, but its final kit boundary remains explicitly unresolved.",
      "recommendedAction": "Sample current built plots and repeated house/site relationships in the affected zone, focusing on setbacks, parcel scale, party-wall incidence, roofs and street-edge treatment.",
      "acceptanceCriteria": [
        "Resolve shared-regional versus Elche-specific treatment.",
        "Retain bounded qualitative ranges rather than false dimensional precision.",
        "Do not generalize the result to Palmeral or pedanía housing."
      ],
      "sourceIssueIds": [
        "issue-elche-z-nuevo-altabix-open-02"
      ],
      "sourceIssueStatements": [
        "Exact current Ciudad Jardín villa grammar remains insufficiently calibrated for a final kit boundary."
      ],
      "sourceIssueOrigins": [
        "Phase 2 remaining-gap statement"
      ]
    },
    {
      "id": "P3-006",
      "title": "Málaga eastern hillside villa / compound boundaries",
      "category": "family-decision",
      "disposition": "phase3-exception-research",
      "priority": "high",
      "phase3Rank": 1,
      "scope": {
        "cityIds": [
          "malaga"
        ],
        "zonesByCity": {
          "malaga": [
            "z-candado",
            "z-cerrado",
            "z-pinares"
          ]
        },
        "buildingIds": [
          "bldg-malaga-coastal-lowrise",
          "bldg-malaga-suburban-row",
          "bldg-malaga-villa"
        ],
        "sharedFamilyIds": [
          "arch-detached-mediterranean-house",
          "arch-lowrise-rowhouse-townhouse"
        ]
      },
      "unresolvedQuestion": "Do Cerrado, Pinares and Candado share one Málaga hillside-villa/compound variation, or do their plot, slope and building relationships justify multiple city-specific subprofiles?",
      "whyItMatters": "The three zones represent a major topography-driven city condition that cannot be reduced to a flat-land villa palette.",
      "recommendedAction": "Compare representative slope relationships, retaining walls, access, setbacks, compound organization, roof form and repeated development patterns across the three zones.",
      "acceptanceCriteria": [
        "Resolve one-versus-multiple Málaga hillside subprofiles.",
        "State what remains shared with the regional detached-villa archetype.",
        "Record slope/site grammar separately from facade styling."
      ],
      "sourceIssueIds": [
        "issue-malaga-z-cerrado-01",
        "issue-malaga-z-pinares-01",
        "issue-malaga-z-candado-01"
      ],
      "sourceIssueStatements": [
        "Current villa/compound patterns remain insufficiently calibrated for final hillside-family boundaries."
      ],
      "sourceIssueOrigins": [
        "Phase 2 remaining-gap statement"
      ]
    },
    {
      "id": "P3-007",
      "title": "Murcia Infante and secondary postwar-estate calibration",
      "category": "family-decision",
      "disposition": "phase3-exception-research",
      "priority": "high",
      "phase3Rank": 2,
      "scope": {
        "cityIds": [
          "murcia"
        ],
        "zonesByCity": {
          "murcia": [
            "z-infante-buenos-aires",
            "z-infante-infante-superblocks"
          ]
        },
        "buildingIds": [
          "bldg-murcia-apartment-perimeter",
          "bldg-murcia-apartment-slab",
          "bldg-murcia-central-mixed-midrise",
          "bldg-murcia-civic-landmark"
        ],
        "sharedFamilyIds": [
          "arch-central-mixed-midrise",
          "arch-open-block-apartment-slab",
          "arch-perimeter-apartment-block"
        ]
      },
      "unresolvedQuestion": "How should Infante and adjacent Buenos Aires postwar fabric be classified relative to Murcia’s already separated La Paz, La Fama and Vistabella subtypes and the shared open-block/perimeter families?",
      "whyItMatters": "Phase 2 successfully decomposed Murcia’s best-known eastern estates; leaving Infante coarse could reintroduce a generic estate treatment into an important contiguous urban area.",
      "recommendedAction": "Sample block/site organization, height bands, access/open space and repeated building forms in the two affected zones, explicitly comparing them with the three already researched east-estate profiles.",
      "acceptanceCriteria": [
        "Assign Infante/Buenos Aires to existing subtype(s) or justify one new city-specific subtype.",
        "Avoid creating a new top-level shared family unless cross-city evidence requires it.",
        "Document regeneration/infill separately from original estate grammar."
      ],
      "sourceIssueIds": [
        "issue-murcia-z-infante-infante-superblocks-01",
        "issue-murcia-z-infante-buenos-aires-01"
      ],
      "sourceIssueStatements": [
        "Infante and other postwar areas outside the three east estates need stronger typology calibration."
      ],
      "sourceIssueOrigins": [
        "Phase 2 remaining-gap statement"
      ]
    },
    {
      "id": "P3-008",
      "title": "Murcia resort-housing family placement",
      "category": "family-decision",
      "disposition": "phase3-exception-research",
      "priority": "high",
      "phase3Rank": 3,
      "scope": {
        "cityIds": [
          "murcia"
        ],
        "zonesByCity": {
          "murcia": [
            "z-sucina-gea-resort"
          ]
        },
        "buildingIds": [
          "bldg-murcia-civic-landmark",
          "bldg-murcia-commercial-box",
          "bldg-murcia-resort-villa",
          "bldg-murcia-villa-detached"
        ],
        "sharedFamilyIds": [
          "arch-detached-mediterranean-house",
          "arch-large-commercial-box"
        ]
      },
      "unresolvedQuestion": "Which current Sucina–Gea y Truyols resort-housing forms belong back in the shared detached-villa or rowhouse/townhouse families, and which remain a distinct Murcia resort variation?",
      "whyItMatters": "The closeout portfolio deliberately excludes Murcia resort housing from the shared low-rise family pending current subtype sampling.",
      "recommendedAction": "Sample representative resort compounds and house types, focusing on attachment, plot/communal-space relationship, roof, facade rhythm and repetition by development.",
      "acceptanceCriteria": [
        "Resolve shared-family membership at subtype level.",
        "Retain resort site grammar even where building structure is shared.",
        "Do not treat all outer Campo housing as resort morphology."
      ],
      "sourceIssueIds": [
        "issue-murcia-z-sucina-gea-resort-02"
      ],
      "sourceIssueStatements": [
        "Resort/industrial facade and plot sampling remains incomplete before final production-kit boundaries are frozen."
      ],
      "sourceIssueOrigins": [
        "Phase 2 remaining-gap statement"
      ],
      "sharedIndexUnresolvedStatements": [
        {
          "familyId": "arch-lowrise-rowhouse-townhouse",
          "familyName": "Low-rise terrace / townhouse / semi-detached family",